{
  "schema_version": "1.0",
  "dataset_id": "per2.validation.k2_exact_states",
  "provenance": {
    "epistemic_role": "independent_finite_validation",
    "generation_path": "per2.semantics.enumeration",
    "k": 2,
    "oracle": "PER2_FINAL_LAYER_ORDER_SEMANTICS"
  },
  "total_states": 56,
  "words": [
    {
      "word": "MMMMMM",
      "states": []
    },
    {
      "word": "MMMMMV",
      "states": []
    },
    {
      "word": "MMMMVM",
      "states": []
    },
    {
      "word": "MMMMVV",
      "states": [
        {
          "state_id": "k2:MMMMVV:ac278685c623482e",
          "order_labels": [
            "A1",
            "A3",
            "B3",
            "B1",
            "B2",
            "B4",
            "A4",
            "A2"
          ],
          "order_ids": [
            0,
            2,
            6,
            4,
            5,
            7,
            3,
            1
          ],
          "row_orders": {
            "upper": [
              "A1",
              "A3",
              "A4",
              "A2"
            ],
            "lower": [
              "B3",
              "B1",
              "B2",
              "B4"
            ]
          },
          "features": {
            "pivots": {
              "upper": 1,
              "lower": 3
            },
            "pivots_provenance": {
              "epistemic_role": "theorem_derived",
              "generation_path": "per2.theory.pivots.recover_pivots",
              "k": 2,
              "word": "MMMMVV",
              "scope": "annotation on independently enumerated state"
            }
          },
          "semantic_validation": {
            "accepted": true,
            "provenance": {
              "epistemic_role": "independent_finite_validation",
              "generation_path": "per2.semantics.validity.validate_state",
              "k": 2,
              "word": "MMMMVV"
            }
          }
        },
        {
          "state_id": "k2:MMMMVV:1a5417c6657876b4",
          "order_labels": [
            "A1",
            "A3",
            "B3",
            "B4",
            "A4",
            "B1",
            "B2",
            "A2"
          ],
          "order_ids": [
            0,
            2,
            6,
            7,
            3,
            4,
            5,
            1
          ],
          "row_orders": {
            "upper": [
              "A1",
              "A3",
              "A4",
              "A2"
            ],
            "lower": [
              "B3",
              "B4",
              "B1",
              "B2"
            ]
          },
          "features": {
            "pivots": {
              "upper": 1,
              "lower": 2
            },
            "pivots_provenance": {
              "epistemic_role": "theorem_derived",
              "generation_path": "per2.theory.pivots.recover_pivots",
              "k": 2,
              "word": "MMMMVV",
              "scope": "annotation on independently enumerated state"
            }
          },
          "semantic_validation": {
            "accepted": true,
            "provenance": {
              "epistemic_role": "independent_finite_validation",
              "generation_path": "per2.semantics.validity.validate_state",
              "k": 2,
              "word": "MMMMVV"
            }
          }
        },
        {
          "state_id": "k2:MMMMVV:5322b07bf219956a",
          "order_labels": [
            "A1",
            "B1",
            "A3",
            "B3",
            "B4",
            "A4",
            "B2",
            "A2"
          ],
          "order_ids": [
            0,
            4,
            2,
            6,
            7,
            3,
            5,
            1
          ],
          "row_orders": {
            "upper": [
              "A1",
              "A3",
              "A4",
              "A2"
            ],
            "lower": [
              "B1",
              "B3",
              "B4",
              "B2"
            ]
          },
          "features": {
            "pivots": {
              "upper": 1,
              "lower": 1
            },
            "pivots_provenance": {
              "epistemic_role": "theorem_derived",
              "generation_path": "per2.theory.pivots.recover_pivots",
              "k": 2,
              "word": "MMMMVV",
              "scope": "annotation on independently enumerated state"
            }
          },
          "semantic_validation": {
            "accepted": true,
            "provenance": {
              "epistemic_role": "independent_finite_validation",
              "generation_path": "per2.semantics.validity.validate_state",
              "k": 2,
              "word": "MMMMVV"
            }
          }
        },
        {
          "state_id": "k2:MMMMVV:fa58143d18e7c57b",
          "order_labels": [
            "A3",
            "A1",
            "B1",
            "B3",
            "B4",
            "B2",
            "A2",
            "A4"
          ],
          "order_ids": [
            2,
            0,
            4,
            6,
            7,
            5,
            1,
            3
          ],
          "row_orders": {
            "upper": [
              "A3",
              "A1",
              "A2",
              "A4"
            ],
            "lower": [
              "B1",
              "B3",
              "B4",
              "B2"
            ]
          },
          "features": {
            "pivots": {
              "upper": 3,
              "lower": 1
            },
            "pivots_provenance": {
              "epistemic_role": "theorem_derived",
              "generation_path": "per2.theory.pivots.recover_pivots",
              "k": 2,
              "word": "MMMMVV",
              "scope": "annotation on independently enumerated state"
            }
          },
          "semantic_validation": {
            "accepted": true,
            "provenance": {
              "epistemic_role": "independent_finite_validation",
              "generation_path": "per2.semantics.validity.validate_state",
              "k": 2,
              "word": "MMMMVV"
            }
          }
        },
        {
          "state_id": "k2:MMMMVV:266825001ace187d",
          "order_labels": [
            "A3",
            "B3",
            "A1",
            "B1",
            "B2",
            "A2",
            "B4",
            "A4"
          ],
          "order_ids": [
            2,
            6,
            0,
            4,
            5,
            1,
            7,
            3
          ],
          "row_orders": {
            "upper": [
              "A3",
              "A1",
              "A2",
              "A4"
            ],
            "lower": [
              "B3",
              "B1",
              "B2",
              "B4"
            ]
          },
          "features": {
            "pivots": {
              "upper": 3,
              "lower": 3
            },
            "pivots_provenance": {
              "epistemic_role": "theorem_derived",
              "generation_path": "per2.theory.pivots.recover_pivots",
              "k": 2,
              "word": "MMMMVV",
              "scope": "annotation on independently enumerated state"
            }
          },
          "semantic_validation": {
            "accepted": true,
            "provenance": {
              "epistemic_role": "independent_finite_validation",
              "generation_path": "per2.semantics.validity.validate_state",
              "k": 2,
              "word": "MMMMVV"
            }
          }
        },
        {
          "state_id": "k2:MMMMVV:aa879287b36d1b5f",
          "order_labels": [
            "A3",
            "B3",
            "B4",
            "A1",
            "B1",
            "B2",
            "A2",
            "A4"
          ],
          "order_ids": [
            2,
            6,
            7,
            0,
            4,
            5,
            1,
            3
          ],
          "row_orders": {
            "upper": [
              "A3",
              "A1",
              "A2",
              "A4"
            ],
            "lower": [
              "B3",
              "B4",
              "B1",
              "B2"
            ]
          },
          "features": {
            "pivots": {
              "upper": 3,
              "lower": 2
            },
            "pivots_provenance": {
              "epistemic_role": "theorem_derived",
              "generation_path": "per2.theory.pivots.recover_pivots",
              "k": 2,
              "word": "MMMMVV",
              "scope": "annotation on independently enumerated state"
            }
          },
          "semantic_validation": {
            "accepted": true,
            "provenance": {
              "epistemic_role": "independent_finite_validation",
              "generation_path": "per2.semantics.validity.validate_state",
              "k": 2,
              "word": "MMMMVV"
            }
          }
        },
        {
          "state_id": "k2:MMMMVV:8030b0b22b531d27",
          "order_labels": [
            "A3",
            "B3",
            "B4",
            "A4",
            "A1",
            "B1",
            "B2",
            "A2"
          ],
          "order_ids": [
            2,
            6,
            7,
            3,
            0,
            4,
            5,
            1
          ],
          "row_orders": {
            "upper": [
              "A3",
              "A4",
              "A1",
              "A2"
            ],
            "lower": [
              "B3",
              "B4",
              "B1",
              "B2"
            ]
          },
          "features": {
            "pivots": {
              "upper": 2,
              "lower": 2
            },
            "pivots_provenance": {
              "epistemic_role": "theorem_derived",
              "generation_path": "per2.theory.pivots.recover_pivots",